<?xml version="1.0" encoding="UTF-8"?>
<!DOCTYPE personinfo SYSTEM "personinfo.dtd"><!-- DTD - Document Type Defination -->
<personinfo>
    <person pid="P1">
        <name>
            <firstname>Pranav</firstname>
            <lastname>Bhokare</lastname>
        </name>
        <profession>Student</profession>
        <age>21</age>
        <city>Ichalkaranji</city>
    </person>
    <person pid="P2">
        <name>
            <firstname>ABC</firstname>
            <lastname>XYZ</lastname>
        </name>
        <profession>Teacher</profession>
        <age>42</age>
        <city>Kolhapur</city>
    </person>
</personinfo>